{
  "$schema": "https://json-schema.org/draft/2020-12/schema",
  "$id": "https://jumpserver.org/schemas/client-plugin/connect.json",
  "title": "JumpServer Plugin Connect Definition",
  "type": "object",
  "required": ["platform", "executable", "launch"],
  "additionalProperties": false,
  "properties": {
    "platform": {
      "type": "string",
      "enum": ["windows", "macos", "linux"]
    },
    "display_name": {
      "type": "string",
      "description": "Platform-specific display name override"
    },
    "match_first": {
      "type": "array",
      "items": { "type": "string" },
      "default": []
    },
    "is_default": {
      "type": "boolean",
      "default": false
    },
    "is_set": {
      "type": "boolean",
      "default": false
    },
    "is_internal": {
      "type": "boolean",
      "default": false
    },
    "executable": { "$ref": "#/$defs/executable" },
    "launch": { "$ref": "#/$defs/launch" },
    "env": {
      "type": "object",
      "additionalProperties": { "type": "string" },
      "description": "Extra environment variables with template support"
    }
  },
  "$defs": {
    "executable": {
      "type": "object",
      "required": ["type"],
      "additionalProperties": false,
      "properties": {
        "type": {
          "type": "string",
          "enum": ["bundled", "system", "user_path", "application_bundle"]
        },
        "default": {
          "type": "string",
          "description": "Default path or command name"
        },
        "required": {
          "type": "boolean",
          "default": false,
          "description": "If true, user must configure path before enabling (user_path or application_bundle)"
        }
      }
    },
    "launchArgs": {
      "type": "object",
      "required": ["type", "template"],
      "additionalProperties": false,
      "properties": {
        "type": { "const": "args" },
        "template": { "type": "string" },
        "driver": { "type": "string" },
        "application_id": { "type": "string" },
        "use_ssh_helper": { "type": "boolean" },
        "protocol_aliases": {
          "type": "object",
          "additionalProperties": { "type": "string" }
        },
        "protocol_templates": {
          "type": "object",
          "additionalProperties": { "type": "string" }
        },
        "split_mode": {
          "type": "string",
          "enum": ["space", "shell"],
          "default": "space",
          "description": "How to split template into argv after substitution"
        }
      }
    },
    "launchScript": {
      "type": "object",
      "required": ["type", "script"],
      "additionalProperties": false,
      "properties": {
        "type": { "const": "script" },
        "script": {
          "type": "string",
          "description": "Relative path to script inside plugin directory"
        },
        "interpreter": {
          "type": "string",
          "description": "Optional interpreter override. node uses Electron's bundled Node runtime."
        },
        "input": {
          "type": "string",
          "enum": ["env", "stdin"],
          "default": "env",
          "description": "Pass connection JSON via JMS_CONNECT_JSON or stdin"
        },
        "serialize": {
          "type": "boolean",
          "default": false,
          "description": "Queue launches of this script until the previous handoff finishes"
        },
        "use_ssh_helper": { "type": "boolean" },
        "protocol_aliases": {
          "type": "object",
          "additionalProperties": { "type": "string" }
        }
      }
    },
    "launchUrl": {
      "type": "object",
      "required": ["type", "template"],
      "additionalProperties": false,
      "properties": {
        "type": { "const": "url" },
        "template": { "type": "string" }
      }
    },
    "launchFile": {
      "type": "object",
      "required": ["type", "extension"],
      "additionalProperties": false,
      "properties": {
        "type": { "const": "file" },
        "extension": { "type": "string" },
        "open_with": {
          "type": "string",
          "enum": ["system", "executable"],
          "default": "system"
        },
        "arg_template": {
          "type": "string",
          "description": "Args when open_with is executable, {file} for temp path"
        }
      }
    },
    "launchAutoIt": {
      "type": "object",
      "required": ["type", "steps"],
      "additionalProperties": false,
      "properties": {
        "type": { "const": "autoit" },
        "steps": {
          "type": "array",
          "items": {
            "type": "object",
            "required": ["cmd"],
            "properties": {
              "cmd": { "type": "string" },
              "type": { "type": "string" },
              "element": { "type": "string" }
            }
          }
        }
      }
    },
    "launch": {
      "oneOf": [
        { "$ref": "#/$defs/launchArgs" },
        { "$ref": "#/$defs/launchScript" },
        { "$ref": "#/$defs/launchUrl" },
        { "$ref": "#/$defs/launchFile" },
        { "$ref": "#/$defs/launchAutoIt" }
      ]
    }
  }
}
