{
  "platform": "macos",
  "match_first": [],
  "is_default": false,
  "is_set": false,
  "is_internal": false,
  "executable": {
    "type": "user_path",
    "default": "/Applications/Another Redis Desktop Manager.app/Contents/MacOS/Another Redis Desktop Manager",
    "required": false
  },
  "launch": {
    "type": "args",
    "template": "--host {host} --port {port} --auth {username}@{value}"
  },
  "display_name": "Another Redis Desktop Manager"
}
