{
  "platform": "windows",
  "match_first": [],
  "is_default": false,
  "is_set": false,
  "is_internal": false,
  "executable": {
    "type": "user_path",
    "default": "",
    "required": true
  },
  "launch": {
    "type": "file",
    "extension": "rdp",
    "open_with": "system"
  },
  "display_name": "Remote Desktop Manager"
}
