{
  "platform": "macos",
  "match_first": [],
  "is_default": false,
  "is_set": true,
  "is_internal": true,
  "executable": {
    "type": "bundled",
    "default": "Terminal"
  },
  "launch": {
    "type": "args",
    "driver": "terminal",
    "application_id": "com.apple.Terminal",
    "template": "",
    "protocol_templates": {
      "redis": "redis-cli -h {host} -p {port} -a {username}@{value}",
      "oracle": "sqlplus {username}/{value}@{host}:{port}/{dbname}",
      "dameng": "disql {dameng_disql}",
      "postgresql": "psql 'user={username} password={value} host={host} dbname={dbname} port={port}'",
      "mysql": "mysql -u {username} -p{value} -h {host} -P {port} {dbname}",
      "oceanbase": "obclient -u {obclient_user} -p{obclient_password} -h {host} -P {port} {obclient_database}",
      "mariadb": "mysql -u {username} -p{value} -h {host} -P {port} {dbname}",
      "sqlserver": "sqlcmd -S {host},{port} -U {username} -P {value} -d {dbname}",
      "mongodb": "mongosh {mongodb_shell_uri}"
    }
  },
  "display_name": "Terminal"
}
