{
  "platform": "windows",
  "match_first": [],
  "is_default": false,
  "is_set": false,
  "is_internal": false,
  "executable": {
    "type": "user_path",
    "default": "",
    "required": true
  },
  "launch": {
    "type": "args",
    "template": "-newtab {name} -url {protocol}://{username}:{value}@{host}:{port}"
  },
  "display_name": "XShell"
}
