{
  "platform": "windows",
  "match_first": [],
  "is_default": false,
  "is_set": false,
  "is_internal": false,
  "executable": {
    "type": "user_path",
    "default": "",
    "required": true
  },
  "launch": {
    "type": "args",
    "template": "-S {host},{port} -U {username} -P {value} -d {dbname}"
  },
  "display_name": "SQL Server Management Studio"
}
