{
  "platform": "macos",
  "match_first": [],
  "is_default": false,
  "is_set": false,
  "is_internal": false,
  "executable": {
    "type": "user_path",
    "default": "/Applications/TigerVNC.app/Contents/MacOS/vncviewer",
    "required": false
  },
  "launch": {
    "type": "args",
    "template": "{host}::{port}"
  },
  "env": {
    "VNC_USERNAME": "{username}",
    "VNC_PASSWORD": "{value}"
  },
  "display_name": "TigerVNC"
}
