{
  "platform": "windows",
  "match_first": [],
  "is_default": false,
  "is_set": false,
  "is_internal": false,
  "executable": {
    "type": "user_path",
    "default": "",
    "required": true
  },
  "launch": {
    "type": "args",
    "template": "{host}::{port}"
  },
  "env": {
    "VNC_USERNAME": "{username}",
    "VNC_PASSWORD": "{value}"
  },
  "display_name": "TigerVNC"
}
